<?xml version="1.0" encoding="UTF-8"?>
<tns:patient xmlns:tns="http://dev.atechlab.net/Patient"
	xmlns:xsi="http://www.w3.org/2001/XMLSchema-instance"
	xsi:schemaLocation="http://dev.atechlab.net/Patient Patient.xsd" 
	id="123">
	<tns:name>Kuhu</tns:name>
	<tns:age>0</tns:age>
	<tns:dob>2001-01-01</tns:dob>
	<tns:email>tns:email</tns:email>
	<tns:gender>F</tns:gender>
	<tns:mobile>tns:phone</tns:mobile>
	<tns:phone>tns:phone</tns:phone>
	<tns:payment>
		<tns:insurance>
			<tns:provider> Blue Cross</tns:provider>
			<tns:limit> 3000</tns:limit>
		</tns:insurance>
	</tns:payment>
</tns:patient>
